{
  "command": "check",
  "files": [],
  "ok": false,
  "project_diagnostics": [
    {
      "code": "E-REMOVED-PROJECT-KEY",
      "layer": "logic",
      "message": "`sequence:` was removed from lute.project.yaml and is never read; 0.37 has no replacement key — declare each chain in `chapters: [{ on: <occasion>, scenes: [<scene id>, …] }]`",
      "path": "./lute.project.yaml",
      "severity": "error",
      "span": {
        "byte_end": 63,
        "byte_start": 55,
        "column": 1,
        "line": 5,
        "utf16_range": [
          55,
          63
        ]
      },
      "spec": [
        "dsl 0.37.0 §2.2"
      ]
    }
  ],
  "schemaVersion": "0.48.0.check"
}
